name,type,geography,fit,source_url,next_action
CalRecycle Edible Food Recovery Grant Program,Grant,California,Funds edible food collection and food waste prevention projects,https://calrecycle.ca.gov/funding/foodwaste/,Monitor current cycle and eligibility
StopWaste Current Grant Programs,Grant,Alameda County,Equipment grants for food recovery and reusable systems,https://www.stopwaste.org/reducing-waste/grants-funding/current-opportunities,Check deadlines and eligible applicant type
USDA Funding for Food Waste Reduction Projects,Grant/loan resource,United States,Guide to federal funding that may support food loss and waste reduction,https://www.usda.gov/foodlossandwaste/funding,Review for nonprofit versus for-profit eligibility
EPA Funding Opportunities Related to Wasted Food,Grant resource,United States,Directory of wasted-food funding opportunities,https://www.epa.gov/sustainable-management-food/funding-opportunities-related-wasted-food,Monitor monthly
USDA Community Food Projects Competitive Grants Program,Grant,United States,Food security projects with community participation,https://www.nifa.usda.gov/grants/programs/hunger-food-security-programs/community-food-projects-competitive-grant-program-cfpcgp,Assess fit if nonprofit/fiscal sponsor path
East Bay Community Foundation,Foundation,East Bay,Local food security donor-advised funding ecosystem,https://www.ebcf.org/,Identify program officers or DAF introduction path
Corporate workplace pilot,Customer funding,Oakland/SF,Company pays for pilot pickup package,local outreach,Interview workplace/event leads
Corporate sponsorship route,Sponsorship,Oakland/SF,Company sponsors food recovery route for community impact,local outreach,Build sponsor one-pager
