segment,prospect_type,why_target,next_action
Oakland office buildings,Property managers,Can introduce multiple tenants and building-wide sustainability programs,Build list of downtown Oakland buildings
Coworking spaces,Workplace/community managers,Recurring catered events and community programming,Identify Oakland and Emeryville sites
Event venues,Venue operations,Catering surplus occurs after events and conferences,Build venue outreach list
Corporate cafeterias,Foodservice managers,Recurring surplus and operational staff,Interview on barriers
Large caterers,Catering sales/ops,Can bundle recovery into client proposals,Build caterer list from Oakland/SF event searches
Law/accounting/consulting offices,Office managers,Frequent client meetings and catered trainings,Use personal network for warm intros
Universities and institutes,Events/sustainability teams,Large events and mission alignment,Interview Berkeley/Oakland-adjacent contacts
Healthcare/admin offices,Facilities/workplace teams,Recurring meetings and foodservice complexity,Assess food safety requirements
